{
  "source_id": "SRC-0025",
  "name": "EuDML",
  "source_type": "journal",
  "base_url": "https://eudml.org/",
  "access_method": "web_page",
  "license": "各期刊许可不一",
  "attribution_required": true,
  "refresh_policy": "quarterly",
  "trust_tier": "C",
  "priority_tier": "P1",
  "connector_version": "none",
  "content_formats": [
    "html",
    "pdf"
  ],
  "allowed_usage": [
    "source_link",
    "full_text_index"
  ],
  "enabled": false,
  "notes": ""
}
