{
  "source_id": "SRC-0024",
  "name": "HAL",
  "source_type": "preprint_server",
  "base_url": "https://api.archives-ouvertes.fr/",
  "access_method": "http_api",
  "license": "开放（Etalab）",
  "attribution_required": true,
  "refresh_policy": "monthly",
  "trust_tier": "C",
  "priority_tier": "P1",
  "connector_version": "none",
  "content_formats": [
    "json"
  ],
  "allowed_usage": [
    "metadata",
    "full_text_index"
  ],
  "enabled": false,
  "notes": ""
}
